{
  "country": "United Kingdom",
  "category": "politics",
  "timestamp": "2025-10-26T06:42:43.357439+00:00",
  "leadership_and_government": {
    "government_type": "Unitary parliamentary constitutional monarchy ",
    "monarch": "Charles III",
    "prime_minister": "Keir Starmer",
    "legislature": "Parliament",
    "president": "King – Charles III [ II ]"
  },
  "recent_and_upcoming": {
    "recent_policies": [
      {
        "title": "MHRA smashes major illicit weight loss medicine production facility in record seizure - GOV.UK",
        "url": "https://news.google.com/rss/articles/CBMiugFBVV95cUxQczBJYmxtRzVFbGZhLTVUMHFuckIwTmZBNjVFUXRob0h5ZE9uR3FWblpDTFNkS2Yzdm5PcjR0Y3JIdDgzLXNKaXloa3FkaG5XTDFUQjh4bkw3akQzQ3pIMVpXQlJhdFhEa2g4VDRwLU4yaVhTMTdGejhub3ZUazd3QW9qTEdubzFuOG96bUpJNElOQTZpUlJQbVhfQUZjNEVpY3FDYkRPMm1xQ1dfT3JPdFlOd3JfM0ZhU3c?oc=5",
        "source": "GOV.UK",
        "published_at": "Fri, 24 Oct 2025 10:54:43 GMT"
      },
      {
        "title": "Check your electronic travel authorisation (ETA) - GOV.UK",
        "url": "https://news.google.com/rss/articles/CBMiQkFVX3lxTE5FRjhFM244bzNWYWV0VGJPZzgyZ05BM1lIdXpXTmNhNVBITFZ6RlpoOGFacTdRVmFDRm92ZHF5WlVWQQ?oc=5",
        "source": "GOV.UK",
        "published_at": "Wed, 22 Oct 2025 13:09:14 GMT"
      },
      {
        "title": "Development consent order deadlines and designation of National Networks National Policy Statement - GOV.UK",
        "url": "https://news.google.com/rss/articles/CBMi0wFBVV95cUxPbDItMnVQUENTdWdsb2ZvdERUTlRsRVIxalJRbTFzWGRpWHdhSDJBREdlNGMyLWU0XzVIQVdyUXpmZ2VKTHBxM0JVVHRrN0c2am1sX0J0RThMRTl3Q1Y1cnlOTjdEQm1kbDFHYnA3UkZGNEI1dXJhR2YyMnpHX0xEY0NySUtqZXFmWDFDdmpYem13T1ZwUENpMG5TVXlzQTRZSnNsWHNmQThUYk8zN3dqNENSUGVIdkxlU0UxNXI0dHZoZXQxUllwaFJ6bWp3eHc0Z0pJ?oc=5",
        "source": "GOV.UK",
        "published_at": "Fri, 24 May 2024 07:00:00 GMT"
      },
      {
        "title": "Presidential executive order on inbound migration to US - GOV.UK",
        "url": "https://news.google.com/rss/articles/CBMilAFBVV95cUxOXy1Odk5NbmM4dmFoenMxQmhla3haR3NPMms2MkdQRTlXMUU3ZDBSbzZSaDhyME1VbkY4eXJOWTF4cVJNeVFFMmduSTV2ZHlYVmhSbmYzVDZhc0QwWlRCMEFiV1k5NFZhaFJiOE0zUUs3dHllLUsyZkRiVlRfejdyVVVWYVdadnYzaGg3TDd1Zld6VUI5?oc=5",
        "source": "GOV.UK",
        "published_at": "Sun, 29 Jan 2017 08:00:00 GMT"
      },
      {
        "title": "Modification Orders Revised Policy Statement - Cornwall Council",
        "url": "https://news.google.com/rss/articles/CBMixAFBVV95cUxQbUFiTzFrU0ZGdWJ0czVXSm84emY5R05KWldJSUFicGdqMUdhazdrUEt1bGlxSWxTTHdRS25KUGM2YUVfRkFRMVRwYVh5WnBPWm44ZEZhWjdFaEc0dVpDc2lSajBoTzlCUHMzTFhsUWNINHJrcXRCdllJMzktNm9SRDJYcDNOdTA5eWdpZ3E5eXBQejNYbHVmTTlZTGJMV0dUN2VsWnlQWl9BdVlJMDdUZS1XMzF6NzJWWC1hU2lLR0t4U3ZY?oc=5",
        "source": "Cornwall Council",
        "published_at": "Fri, 12 Jan 2024 08:00:00 GMT"
      },
      {
        "title": "Statement of Policy with respect to Financial Penalties and Consumer Redress - Ofgem",
        "url": "https://news.google.com/rss/articles/CBMioAFBVV95cUxPTUc0MHh3Y0Z4QmpnRHBBX1JNS1lvTllaVDRzcGVwalQ4WDl4YVlXT2FPTkpyM1FLU3N0QUZJQ0FPN21EVlZNazZSX0xpSnN4QzFfMFJSWWF0VzJjWUhRTzRDbUswRzBfTzV1cGNYekRVYTFXYXJwaXgweFhYVDhqanFtUTZoQ0FqRzY2bzdualRpbDVpejNNQ1ZNSDF3ZEtw?oc=5",
        "source": "Ofgem",
        "published_at": "Wed, 23 Mar 2022 07:00:00 GMT"
      },
      {
        "title": "CMA orders Meta to sell Giphy - GOV.UK",
        "url": "https://news.google.com/rss/articles/CBMickFVX3lxTE4tUkhYYXZlaVpNTXZrYnl5ekNReXFZc0ZkUTBrVVhNWlBibDFOZl92bVRudXdLTFlfVDRFN2ZYNzBtQU1obTlaMjBHdjBfRHVmbGFUSEhYd05VSEEzdkZwRTN3ekpGRlVyZHhnc0RrN2REQQ?oc=5",
        "source": "GOV.UK",
        "published_at": "Tue, 18 Oct 2022 07:00:00 GMT"
      },
      {
        "title": "Cyber Security and Resilience Bill: policy statement - GOV.UK",
        "url": "https://news.google.com/rss/articles/CBMimgFBVV95cUxNaHFteXRYc2NsYkFKMzZDNWVkSnJTMko4UHl4Zjd0Z0ZYazdEX2V4ZEF4RnlWRFMwd2NfTFFyNjR2LUp4V1ZUN0dTZjZFYXotT1RpcERWbElSNmJfN0I0R1piUGZ5aFlXaWFiSkQwTHpVRFRRWmk3UTBkVnZsNXNJY0VlVm8wcFpjbk5uVTV5aU9EWVk0UktaSG5n?oc=5",
        "source": "GOV.UK",
        "published_at": "Tue, 01 Apr 2025 07:00:00 GMT"
      }
    ]
  },
  "political_climate": {
    "key_issues": [
      "Ethnic diversity in politics and public life - The House of Commons Library",
      "Politics latest: Lucy Powell named as new deputy leader of the Labour party - Sky News",
      "Labour Party - Social Democracy, UK Politics, Trade Unions - Britannica",
      "2025 will be a challenging year in UK politics - The Hill",
      "How England’s new Reform councillors compare in their views to other parties - The Conversation"
    ],
    "controversies": [],
    "recent_headlines": [
      {
        "headline": "Ethnic diversity in politics and public life - The House of Commons Library",
        "source": "The House of Commons Library",
        "url": "https://news.google.com/rss/articles/CBMickFVX3lxTE9ER2pjS3NXODdSSkRMME9tQ2s1bTBOa0FMUzNsdlVQdVZOMmZUZ2tfOW4tSVZxYkNGWFFMNVEzTjFIQnJwUmVXc2JsWkxFeFNvOXN6b3dYTWFzQjdGb0hNOUhXTE9pS19Yb2V0UTRwTWdQQQ?oc=5",
        "published": "Tue, 21 Oct 2025 08:48:45 GMT",
        "sentiment": "neutral"
      },
      {
        "headline": "Politics latest: Lucy Powell named as new deputy leader of the Labour party - Sky News",
        "source": "Sky News",
        "url": "https://news.google.com/rss/articles/CBMirAFBVV95cUxPRGF0MFdUbnZzemsxWGdpWHdldTlPR2tqMmY3OTJHV0doRXhST1VrN3FIbThBYlBtU2tZU1BHYTNpTkpZY1l1WVNaM1l4M2pmdmJra2xGVHVhRkpKSklJRkh2UUItSTFKcXFXOF9ReWZBRWRpcjU5TzdKREtkQlRlT0FFOWtnclZSRDQtT1l3TnlNZUZsdnJFOXE4QnJSZ0F0X0trbzJTejhCc2xa?oc=5",
        "published": "Sun, 26 Oct 2025 03:49:37 GMT",
        "sentiment": "neutral"
      },
      {
        "headline": "Labour Party - Social Democracy, UK Politics, Trade Unions - Britannica",
        "source": "Britannica",
        "url": "https://news.google.com/rss/articles/CBMiigFBVV95cUxPdVZhakoyYnVGT1RRTU85NzZ2WDBCQTJIX2ViVElXSVZCSVhUMF9aUEZEYWhXczdxYkdmVEIxamZyNTYzU1dwdkNfRjJkLTh4WjIxc0wtWUJNM3hReS1OZ211dlVxbU5pNENma08tcUFhdnRQT1RUZWtTc002aWxNUVQ4UHM3NGttLWc?oc=5",
        "published": "Wed, 22 Oct 2025 05:00:00 GMT",
        "sentiment": "neutral"
      },
      {
        "headline": "2025 will be a challenging year in UK politics - The Hill",
        "source": "The Hill",
        "url": "https://news.google.com/rss/articles/CBMingFBVV95cUxOckY5Y3dMbWNYZWpqc2dSTTFab0tTVFhuLTdfbXVrWHdTNk1WSThGRmdabW1vZWdGaWZxQ3NyUWU0T1d2X0Jzakc0YlNlWE9mYkJGX2hGTzBwZnhuYkJqTENKcHZRYWpWWC1vZVBkdVBQcUFqbGs1dHhZSHF2Wk5vRVVkWEo3SERNTEZyMVNaS2hEQldiWG9ONmluUDlid9IBowFBVV95cUxOZ2JXbjhkVHdPZ1JHdTN1UkZ5alVFUFdXTVh0dHQ2dlJmamxyR0xGUHBUY2VUaHcxTC1zdFEzTkEyNmdZRGNjeHhHNy03bTRyQTIwUVBVZUcwZjloLTBBdUVCNm9nX1NXZkxiMjhHUTRqZzVwRUpacDl2WXNHWkpsekl1cWU0NzdYVjBXWXlybGJyLXZVWnFjNGRxSHdOLVRoT3Z3?oc=5",
        "published": "Thu, 23 Jan 2025 08:00:00 GMT",
        "sentiment": "neutral"
      },
      {
        "headline": "How England’s new Reform councillors compare in their views to other parties - The Conversation",
        "source": "The Conversation",
        "url": "https://news.google.com/rss/articles/CBMirwFBVV95cUxORm9WRXM0c3M5aGIzYm91Y3Y5cmxjdE9ER093cmZOcVpodGF1UlE5aUg0ZktfMTdFWnE1YzFnY1ptc2lNeFB5dWZ6TFlfNUtRUjVYeDV6NHMycEFfcGpjM1VmdnJ1ZlZROWlBWEllNDRvNlBVeFU0VkxEZzZuN0Zfd3ZzMDFGQTdNNU9qTEdKOEVMaFZkTXFQanVSREtLNTFteHgzUFdmYk9MQy1XMWtn?oc=5",
        "published": "Fri, 24 Oct 2025 11:48:15 GMT",
        "sentiment": "positive"
      },
      {
        "headline": "Independent Thinking: In UK politics is Reform now the party to beat? - Chatham House",
        "source": "Chatham House",
        "url": "https://news.google.com/rss/articles/CBMilgFBVV95cUxQLUNhRTFka1daN21qQ0k0dENPWWM0NDhuRE9ZR3lFWEJZbDNKVkQtRURqLXAtUDRLSmE2WUlUWFNVUjFMa1pQOTlfZ2psSzN4T28ySWlGOTZnemxaTkFneTBLcmpsVThJX2VWNkxacEJ4Vk9tQmFZMm50cWFiMzZSNk5zMEs2eWt6NW5TSm9DaFFfTHFXRnc?oc=5",
        "published": "Fri, 03 Oct 2025 07:00:00 GMT",
        "sentiment": "positive"
      },
      {
        "headline": "UK government minister to Musk: ‘Get the hell out of our politics’ - politico.eu",
        "source": "politico.eu",
        "url": "https://news.google.com/rss/articles/CBMilgFBVV95cUxNU2puQ2Mzbjl0OGpIRDRnNmpUbDM1SXRpRlRTY0lBWjRxLXFWNE9iY0wyRW5fWUFtSEstd1dtQXljSTNjOFpsaHFaYVV6cXZtbVBLTnZzTG9TR0FiUXZ5RG0wYnZDbHEwMHBKY2VacUxwSER6bFlyU1g3bzAxNmQ1NnNFMlhEYXZjby1aSkxvQ3F5aE02NVE?oc=5",
        "published": "Wed, 01 Oct 2025 07:00:00 GMT",
        "sentiment": "neutral"
      },
      {
        "headline": "Turkey Says Eurofighter Talks Advancing with UK - politicstoday.org",
        "source": "politicstoday.org",
        "url": "https://news.google.com/rss/articles/CBMif0FVX3lxTE9qLU5DQTJaS19vZEFaTVkzS0FEc1BDWXk5bUFEMjZKdFdQNzJ2aEc5NFJZUE56NkxIRFdJdzJfT3JJbjl6T0ZGYUdkSFZkQjlPU0lZdmRSV1VCVWFYcXJoZEltb3dqLU8wdnpTZ1NiZEc1cFA0d24xZUhaMVNTb0U?oc=5",
        "published": "Fri, 24 Oct 2025 06:04:10 GMT",
        "sentiment": "neutral"
      }
    ]
  },
  "summary": {
    "overall_sentiment": "positive",
    "sentiment_score": 62,
    "total_items": 16
  }
}