{
  "country": "United States",
  "category": "politics",
  "timestamp": "2025-10-26T06:43:02.897285+00:00",
  "leadership_and_government": {
    "legislature": "Congress",
    "president": "President – Donald Trump"
  },
  "recent_and_upcoming": {
    "recent_policies": [
      {
        "title": "Modernizing Payments To and From America’s Bank Account - The White House (.gov)",
        "url": "https://news.google.com/rss/articles/CBMisAFBVV95cUxNcG9PbmZQZ3Y2QktySEZ3Qk9CLUZlUkhCQVNYaU9OcldhblI5d2lELTZDMERoTFN3NVdxVkNWYS1saVMwRHRCRzV0MzVrd2FZWDh5d0k3MUJCcmh3YlpWS2E4aUtiOVFoN0FOZjYzSjJLM0FTdHBPdVN0cEN5N3dCZDN4ZHJETWgyT0hGUU9BOGdHSW1UVXl2NFE0dktUQjdKbTV1TjRzNTBCeGlnUDVYOQ?oc=5",
        "source": "The White House (.gov)",
        "published_at": "Tue, 25 Mar 2025 07:00:00 GMT"
      },
      {
        "title": "Designating English as the Official Language of The United States - The White House (.gov)",
        "url": "https://news.google.com/rss/articles/CBMivwFBVV95cUxPVWstRGJ6NGdjWkdISlhOMFozMTY0WTdJeVh2eUd4ajhsb0RRa25qU2JKMjZuU3JHNmFYY3NKU1pxSUg0REkybHlCcThxZm11eFFRSnFXdHprVE1sel9sUG1HZnhRRUdlRl85MlE1empkTkVmVHp1Qjh4ZjJfWDVOQ1hVMXYzUkNKMVc4RkJSZGY0NzlmQjhzX2JlcThKbWxuWmFHSG1ncUVtT256THluSXhORnNMZDFyOHVPMkNpNA?oc=5",
        "source": "The White House (.gov)",
        "published_at": "Sat, 01 Mar 2025 08:00:00 GMT"
      },
      {
        "title": "ENDING ILLEGAL DISCRIMINATION AND RESTORING MERIT-BASED OPPORTUNITY - The White House (.gov)",
        "url": "https://news.google.com/rss/articles/CBMiwgFBVV95cUxNQnludHpURXZwMzhhWGozUnhPQlU5Nk9henI0Y242XzIta1NpRHRtYkw3RWdTRS0tUHZwOURNemlIbm5MS3JNZElzSlJrMU1oZjF4WkVaUThHM1lWdFZWZ3hManFyOHdDTGVRN3Axb3piYm1HVVoyU1ZIYmtWdF9NVTNIczh0N1MwNXhpVjVucy1Kd2xkQnJYdEl1SDJybmhTSVNUX1NZZ3VqT3psbVZhWjF4a1dRbUtBV2VKTkdacTJmQQ?oc=5",
        "source": "The White House (.gov)",
        "published_at": "Tue, 21 Jan 2025 08:00:00 GMT"
      },
      {
        "title": "Executive Orders Archives - The White House (.gov)",
        "url": "https://news.google.com/rss/articles/CBMic0FVX3lxTE9PQ0o3Z05kTlNTQXV6UXJXcGdKNy1BVEZ6U0RjVUxoNGNpdWFQb2dfWjFfcEtBWWdzVDB4Q0xXcWRsTnZmZmkzSWQzTzZIS3haRjVENG9hMWFIbFZjR2IySjVVbDFlNDljczNrMFZweGoxTE0?oc=5",
        "source": "The White House (.gov)",
        "published_at": "Thu, 20 Mar 2025 20:35:05 GMT"
      },
      {
        "title": "Fact Sheet: President Donald J. Trump Makes America’s Showers Great Again - The White House (.gov)",
        "url": "https://news.google.com/rss/articles/CBMiugFBVV95cUxPZUNOSlNNNUQ0SGh3YjQwV2lCbkFfSFEwM2RyWjRQYl9EY25ySnJvaW45M3hMaVVaVTZEY2JLLWQwMVdtV1JsRXdqS0VCRC1SWUdVeVBTVnhCQjRrT19ta2c0TmtjVlhSSXF5V0l6Mlp1OHFzZGhlZGFaVDhLQnJ1dXZUU2tFN0tvdTVRaUpEWXc4Y09kaE1YTUs5MVl1dEMtVERiWldqd2cxbUhDMHNQVElqaGE4VklaNnc?oc=5",
        "source": "The White House (.gov)",
        "published_at": "Wed, 09 Apr 2025 07:00:00 GMT"
      },
      {
        "title": "White House Unveils America’s AI Action Plan - The White House (.gov)",
        "url": "https://news.google.com/rss/articles/CBMikgFBVV95cUxOUUZpWkFSYWROX2p3Tml4aU4tNTB6UjlxbC1pRG1vMDJEVzhiT3dMZ29NTlV3WnNGSzR1RDlvenhSYm42aHdpZDRmNEJjVEludjdIQ0NuMGU1SGdXcUhkbktaX0pIdXpTUDRFRlprbzQzOXgxSnl3MzgxR1R2REtFZFpZSHFMVUVVZkt6R2dWWnprdw?oc=5",
        "source": "The White House (.gov)",
        "published_at": "Wed, 23 Jul 2025 07:00:00 GMT"
      },
      {
        "title": "FURTHER MODIFYING THE RECIPROCAL TARIFF RATES - The White House (.gov)",
        "url": "https://news.google.com/rss/articles/CBMipAFBVV95cUxPTGd5UTBjblhGdkJnRkxTalplSnNydWplS0s0d0RQdENrZm0yZmVYT1p2RHN2eWNqVi1OUkE2UDYyQUdXQ1MwLS1WQ2lzZ3EtV1JaVVp4RVc4bzdYZ1A1VzEzcmQ4bF9VRWVJQVF4RXVWTDBYSWl2U191YkRZbHpVTl9tWFFwc0FLTngyVjFnOG5SdkVHSFJYdHFEUmE0LTI0NGpoTw?oc=5",
        "source": "The White House (.gov)",
        "published_at": "Thu, 31 Jul 2025 07:00:00 GMT"
      },
      {
        "title": "ENSURING CONTINUED ACCOUNTABILITY IN FEDERAL HIRING - The White House (.gov)",
        "url": "https://news.google.com/rss/articles/CBMirAFBVV95cUxOa3A3N1pZZWNPV2t4aVZsRGVEYlNldjFiMF9RQnRkZlFZQ0VxS0JhUHlTTTVudDlKdGZaczJXSE96a196UzFZcEJfb05IMnFqa1JoaXBiLUhIRkphSE45TGh3dWhhbXA5R29md3N4TEo1azNzeVBheklrekR4NVBDMktHWDlVSU5tcUFmRjZUSl9uOXVsRTBmdjNRaXNtZUd6bFF0TmJ4YU1HS3Vm?oc=5",
        "source": "The White House (.gov)",
        "published_at": "Wed, 15 Oct 2025 07:00:00 GMT"
      }
    ]
  },
  "political_climate": {
    "key_issues": [
      "Is the Argentina Bailout a Glimpse Into the Future of the United States? - The Bulwark",
      "Timothy Mellon Is Donor Who Gave $130 Million to Pay Troops During Shutdown - The New York Times",
      "Kamala Harris hints she is ready to run again for US president - politico.eu",
      "The US in brief: San Francisco wins a reprieve - The Economist",
      "Trump adviser Stephen Miller insists East Wing of White House ‘is not part of the White House’ – as it happened - The Guardian"
    ],
    "controversies": [],
    "recent_headlines": [
      {
        "headline": "Is the Argentina Bailout a Glimpse Into the Future of the United States? - The Bulwark",
        "source": "The Bulwark",
        "url": "https://news.google.com/rss/articles/CBMiogFBVV95cUxQaFpycGdzMUw4cWVSRTU0UHlnWE5hbndURE9aQURFaWZYemVqckM3X1hKdmdfalloN0J2bzdVbXpSamJGYUh0Q2JWSjdEbUJWR3NSV0U5OUJVMmllN3ZEdzJkREpQNnVDblgyZkVrRk5OTm51TV9BNmllckVhY182Ri1xbkNSbWJ1Y3BPLUVWaURsa0tOd3JzMWhhaUg5dmRuS0E?oc=5",
        "published": "Fri, 24 Oct 2025 07:39:09 GMT",
        "sentiment": "neutral"
      },
      {
        "headline": "Timothy Mellon Is Donor Who Gave $130 Million to Pay Troops During Shutdown - The New York Times",
        "source": "The New York Times",
        "url": "https://news.google.com/rss/articles/CBMiigFBVV95cUxObHpFT2J3d3BtZTdNdXluMWd3dkczWjdKUEtoeS0wNjFGakRIQjlSOVJfQ2M1Rkx6N2ZqNnZVckxhMlZCNUF1RnBHR2cxR3FqTGF2M3B1UWZhTGFzemc3cVJ2U05mcjU5LWFFZFMyYlNkYzVQRlJaRDRIYTZFT2dHUG9JTGJIWlV1Rnc?oc=5",
        "published": "Sat, 25 Oct 2025 17:22:22 GMT",
        "sentiment": "neutral"
      },
      {
        "headline": "Kamala Harris hints she is ready to run again for US president - politico.eu",
        "source": "politico.eu",
        "url": "https://news.google.com/rss/articles/CBMigAFBVV95cUxOTzlxUWM0U1JHNC1nX2pwY3lma1dyTk9qem1QbXFGWTJ1SHctSVc0V3FySlBFT1hWRjFUaDJJZ2RrTEhwVWU1UlllNngxeXRvckg1WjAyZ0kydjd1aHYxU3A1dEZyaG5BSmV6dzdUbGMwODFjTy1vdmxuS0ZxTlhfTw?oc=5",
        "published": "Sat, 25 Oct 2025 15:15:00 GMT",
        "sentiment": "neutral"
      },
      {
        "headline": "The US in brief: San Francisco wins a reprieve - The Economist",
        "source": "The Economist",
        "url": "https://news.google.com/rss/articles/CBMilgFBVV95cUxPcWw1akR0cFNaR2FuR0NLR09tYWJ5Rmg5UGtLNjZmV0tTdXhreHNURnZudXFZYUVhVmd4endRNUJlQnQ2YmJLWmwyLWZXNlE2S0NiQ2RxMlpoWlhReVBnSGVDM2RUSG53V2hrUld0Vko0Z1ZYcFpMbXI3U3RCZWJVLVVaM2pxdGhtVVlxQkJJMVFYWHZ5akE?oc=5",
        "published": "Fri, 24 Oct 2025 09:52:15 GMT",
        "sentiment": "positive"
      },
      {
        "headline": "Trump adviser Stephen Miller insists East Wing of White House ‘is not part of the White House’ – as it happened - The Guardian",
        "source": "The Guardian",
        "url": "https://news.google.com/rss/articles/CBMi-gFBVV95cUxOVXFQOFRXOVl2NjJ2cXIzTnlCdDJLX1hiVXczN0ZKZ25rb1dhUklkcW0yVHYzOW12WVFrYzIyMkVnV3hBT3VOcHYwTEI0OUR6eExNbzNfdTFlaFNrSmtBY1BfUEU1amNGOGhMdTl3RVdUQ0lHVDVwZGFLbm8tSEl3N0hUN0pUdU56ZXdsZ3BsOWJSOF9hWjBlcW9tSE1maExvckFDQ3l2VzRBVG5LdDZqWjNWSUtnRzMtWkFjMmp5TGRrTGozSzhNa0wxMzhzbHdFcTBKaEJWUWdnRFNOUzI3ZW1MQWgwZERJUmxnTG9mYmxBUXc5UUFSd0hn?oc=5",
        "published": "Fri, 24 Oct 2025 09:31:00 GMT",
        "sentiment": "neutral"
      },
      {
        "headline": "\"I Love Hitler\": What Leaked Group Chats Reveal About US Politics Today - NDTV",
        "source": "NDTV",
        "url": "https://news.google.com/rss/articles/CBMirAFBVV95cUxPNWxSVW5helFteVdsdVJkeWxUSExPN0Zyck5Uckt3ZDFEMWFkZTkycENscll0a3BNVFQydmtDQXQzcG9FZlB2Q0JNTVNGYTY3NklPUFhFWWZJSGpDUzFrZEVadG5XSXpGUXFXbzZYY1RMMGlMb1FYcl9OUDM2QkxZaEVEMWNDR0NFWGRXWklGRlllQ0JsVF8wMW1HXzViNE5LMS0yWWlUcHhhS1h50gG0AUFVX3lxTE9vbTY5QzNUMk5sTW9wS3huWS1IY2thMTFVT3lDUnhfS2Z1RGdNaGFQY1FjY3QyUmpUV1J6Nkt1MkN2X0dPU1lWWG10UVNnQ1czTDdJeXlKTE5JeTRpT05QSUFZTVJ5ZVlwTkhpVkNIMUZqQXM1Xy0wUk41dkpFejV6aHhVVEFDeDZ0T3NUZ0J4NWtuSGx4UFNTRTFqcmJPRUlKcktxMXdVV050WG9JT0x6cGVNeA?oc=5",
        "published": "Fri, 24 Oct 2025 11:13:46 GMT",
        "sentiment": "neutral"
      },
      {
        "headline": "Keeping the House Absent, Johnson Marginalizes Congress and Himself - The New York Times",
        "source": "The New York Times",
        "url": "https://news.google.com/rss/articles/CBMiiAFBVV95cUxPU3JPOGVqMG9WV1JkZTJjVlVtRGVMUW9rQlFLZ2NOeUt4bUNlV1NzZmZoNlVvYVNSc3h0RjhvSzIyVm1MMnRhbmtSNVVISmxpQXRacFRmVERCSldQNHBLVWt5WndVbkdtQmxjZ2lncE1NTlNXaUJNQ19tQTg0ck1SZU9paVJGR20y?oc=5",
        "published": "Sat, 25 Oct 2025 09:01:39 GMT",
        "sentiment": "neutral"
      },
      {
        "headline": "Bannon Claims ‘There Is a Plan’ for Trump to Run for a Third Term - The New York Times",
        "source": "The New York Times",
        "url": "https://news.google.com/rss/articles/CBMijgFBVV95cUxQeEQ2RXZ2MTQ1aUNoQ2ctUUtWSDBkaFJsc2JYVlpSRXhYU2Q3ZGk3bm0wRC1uT2ROTU1YZGdCdDllbi02ZHg4dVZKRzJJZUlwLVJieE5oLW5kUXRnMm1hWklwR2dSV002c0VQODBBTXpWSkxDaktoVlBkNi1jcENmSHE4T21aNVEyMXFrRWhn?oc=5",
        "published": "Fri, 24 Oct 2025 23:47:40 GMT",
        "sentiment": "neutral"
      }
    ]
  },
  "summary": {
    "overall_sentiment": "neutral",
    "sentiment_score": 56,
    "total_items": 16
  }
}